{
	"_comment": "Solstice world generation. Truth: docs/setting/WORLD.md SS2.1 (scale), SS2.4 (world roll), SS3.3 (generation flow). Contract: shared/schema/world.schema.json.",
	"_note": "size / chunk_size are in tiles; 1 tile = 1 m. 512 is the default tier (SS2.1). `default` is the SAFE RECIPE: seed 0 means every new realm rolls a fresh world; these numbers are what the roller falls back to when a roll fails the seven guardrails, and they are the bench baseline. `presets` are recipes that LOCK a few axes and leave the rest to the roll - none of them carries a fixed seed.",
	"_wiring": "Live today (read by SolsticeDataLoader): size / chunk_size / seed / base_water_level / land_ratio / latitude / tidal_amplitude / tides. land_ratio is the land budget the world generator solves its coastline for; the rest of the six-axis fields (relief / ranges / bearing / rivers / lakes / aridity / season_amplitude / weather_bias / wind_dir / vegetation_density / biome_pool / species_pool / sky / start_season / start_hour) are the R-30 contract and are NOT read yet. `algo` is now INERT: the terrain archetype comes from the roll (Sim/SolsticeWorldGen), so a preset that wants a specific landform needs an archetype field, not an algo string.",
	"generator_version": 2,
	"default": {
		"realm_id": "realm.rolled",
		"realm_name": { "zh": "", "en": "" },
		"size": 128,
		"chunk_size": 64,
		"algo": "ridges",
		"seed": 0,
		"land_ratio": 0.62,
		"relief": 0.6,
		"ranges": 2,
		"bearing": 90,
		"rivers": 2,
		"lakes": 1,
		"base_water_level": 3.0,
		"latitude": 31.23,
		"tidal_amplitude": 1.0,
		"tides": false,
		"aridity": 0.45,
		"season_amplitude": 1.0,
		"weather_bias": "temperate",
		"wind_dir": 270,
		"vegetation_density": 0.6,
		"biome_pool": ["water", "grass", "woodland", "rock_slope", "swamp"],
		"species_pool": ["moss", "shrub", "grazer", "raptor", "fish"],
		"sky": {
			"suns": 1,
			"moons": 1,
			"rings": false,
			"aurora": false,
			"star_density": 0.55,
			"sun_tint": "warm"
		},
		"start_season": "spring",
		"start_hour": "morning"
	},
	"presets": [
		{
			"realm_id": "realm.ridges",
			"realm_name": { "zh": "褶皱原", "en": "The Ridged Plain" },
			"size": 128,
			"chunk_size": 64,
			"algo": "ridges",
			"seed": 0,
			"land_ratio": 0.6,
			"relief": 0.85,
			"ranges": 3,
			"bearing": 75,
			"rivers": 3,
			"lakes": 1,
			"base_water_level": 3.0,
			"latitude": 31.23,
			"tidal_amplitude": 1.0,
			"tides": false,
			"aridity": 0.45,
			"season_amplitude": 1.0,
			"weather_bias": "temperate",
			"wind_dir": 270,
			"vegetation_density": 0.6,
			"biome_pool": ["water", "grass", "woodland", "rock_slope"],
			"species_pool": ["moss", "shrub", "grazer", "raptor", "fish"],
			"sky": { "suns": 1, "moons": 1, "rings": false, "aurora": false, "star_density": 0.55, "sun_tint": "warm" },
			"start_season": "spring",
			"start_hour": "morning"
		},
		{
			"realm_id": "realm.isles",
			"realm_name": { "zh": "散岛", "en": "Scattered Isles" },
			"size": 128,
			"chunk_size": 64,
			"algo": "islands",
			"seed": 0,
			"land_ratio": 0.4,
			"relief": 0.55,
			"ranges": 2,
			"bearing": 120,
			"rivers": 1,
			"lakes": 0,
			"base_water_level": 3.0,
			"latitude": 22.54,
			"tidal_amplitude": 1.4,
			"tides": true,
			"aridity": 0.5,
			"season_amplitude": 0.7,
			"weather_bias": "wet",
			"wind_dir": 180,
			"vegetation_density": 0.75,
			"biome_pool": ["water", "grass", "woodland", "swamp"],
			"species_pool": ["moss", "shrub", "grazer", "fish"],
			"sky": { "suns": 1, "moons": 2, "rings": false, "aurora": false, "star_density": 0.65, "sun_tint": "cool" },
			"start_season": "summer",
			"start_hour": "noon"
		},
		{
			"realm_id": "realm.canyon",
			"realm_name": { "zh": "深缝", "en": "The Deep Seam" },
			"size": 128,
			"chunk_size": 64,
			"algo": "canyon",
			"seed": 0,
			"land_ratio": 0.7,
			"relief": 0.7,
			"ranges": 1,
			"bearing": 0,
			"rivers": 2,
			"lakes": 0,
			"base_water_level": 3.0,
			"latitude": 39.9,
			"tidal_amplitude": 0.6,
			"tides": false,
			"aridity": 0.7,
			"season_amplitude": 1.2,
			"weather_bias": "dry",
			"wind_dir": 315,
			"vegetation_density": 0.35,
			"biome_pool": ["water", "grass", "rock_slope"],
			"species_pool": ["moss", "grazer", "raptor"],
			"sky": { "suns": 1, "moons": 0, "rings": false, "aurora": false, "star_density": 0.4, "sun_tint": "gold" },
			"start_season": "autumn",
			"start_hour": "dusk"
		},
		{
			"realm_id": "realm.plateau",
			"realm_name": { "zh": "层台", "en": "Stacked Plateau" },
			"size": 128,
			"chunk_size": 64,
			"algo": "plateau",
			"seed": 0,
			"land_ratio": 0.65,
			"relief": 0.5,
			"ranges": 1,
			"bearing": 45,
			"rivers": 1,
			"lakes": 2,
			"base_water_level": 3.0,
			"latitude": 30.57,
			"tidal_amplitude": 0.8,
			"tides": false,
			"aridity": 0.35,
			"season_amplitude": 1.1,
			"weather_bias": "foggy",
			"wind_dir": 225,
			"vegetation_density": 0.55,
			"biome_pool": ["water", "grass", "woodland", "rock_slope"],
			"species_pool": ["moss", "shrub", "grazer", "raptor"],
			"sky": { "suns": 1, "moons": 1, "rings": true, "aurora": false, "star_density": 0.7, "sun_tint": "warm" },
			"start_season": "spring",
			"start_hour": "dawn"
		},
		{
			"realm_id": "realm.basin",
			"realm_name": { "zh": "浅盆", "en": "Shallow Basin" },
			"size": 128,
			"chunk_size": 64,
			"algo": "basin",
			"seed": 0,
			"land_ratio": 0.6,
			"relief": 0.45,
			"ranges": 2,
			"bearing": 150,
			"rivers": 3,
			"lakes": 3,
			"base_water_level": 3.0,
			"latitude": 34.34,
			"tidal_amplitude": 0.9,
			"tides": false,
			"aridity": 0.3,
			"season_amplitude": 0.9,
			"weather_bias": "wet",
			"wind_dir": 90,
			"vegetation_density": 0.8,
			"biome_pool": ["water", "grass", "woodland", "swamp"],
			"species_pool": ["moss", "shrub", "grazer", "fish"],
			"sky": { "suns": 2, "moons": 1, "rings": false, "aurora": false, "star_density": 0.5, "sun_tint": "gold" },
			"start_season": "summer",
			"start_hour": "morning"
		},
		{
			"realm_id": "realm.archipelago",
			"realm_name": { "zh": "碎礁", "en": "Broken Reef" },
			"size": 128,
			"chunk_size": 64,
			"algo": "archipelago",
			"seed": 0,
			"land_ratio": 0.35,
			"relief": 0.5,
			"ranges": 2,
			"bearing": 105,
			"rivers": 1,
			"lakes": 0,
			"base_water_level": 3.0,
			"latitude": 31.23,
			"tidal_amplitude": 1.8,
			"tides": true,
			"aridity": 0.55,
			"season_amplitude": 0.6,
			"weather_bias": "stormy",
			"wind_dir": 135,
			"vegetation_density": 0.6,
			"biome_pool": ["water", "grass", "woodland", "rock_slope", "swamp"],
			"species_pool": ["moss", "shrub", "raptor", "fish"],
			"sky": { "suns": 1, "moons": 3, "rings": false, "aurora": true, "star_density": 0.85, "sun_tint": "cool" },
			"start_season": "autumn",
			"start_hour": "dusk"
		}
	]
}
